"doi","title","authors","author_corresponding","author_corresponding_institution","date","version","type","license","category","jatsxml","abstract","published","server","posted"
"10.1101/2023.02.24.529913","Laminin-defined Mechanical Status Modulates Retinal Pigment Epithelium Functionality","Kozyrina, A. N.; Piskova, T.; Semeraro, F.; Doolaar, I.; Prapty, T.; Haraszti, T.; Hubert, M.; Windoffer, R.; Leube, R. E.; Smith, A.-S.; Di Russo, J.","Jacopo Di Russo","Interdisciplinary Centre for Clinical Research","2024-08-12","4","new results","cc_by_nc_nd","biophysics","https://www.biorxiv.org/content/early/2024/08/12/2023.02.24.529913.source.xml","Epithelial cells are highly interconnected, whereby they acquire mesoscale mechanical properties to accomplish specific tissue functions. In homeostasis, this mechanical status can be summarised as mechanical homeostasis, regulated by the balance of intercellular tension and extracellular matrix adhesion forces. In the outer retina, the significance of this force balance and its consequences for vision remains poorly understood. We found that the density of basement membrane laminins modulates the level of retinal pigmented epithelium contractility, which directly controls its efficiency in phagocytosing photoreceptor outer segments. In vivo, the density gradient of laminins follows retinal functional demand, supporting the physiological role of laminins in controlling epithelial mechanical homeostasis. Our data suggest that laminin density and isoform heterogeneity can differentially engage integrins {beta}1 and {beta}4, the ratio of which determines the contribution of actin vs keratin cytoskeleton in balancing tissue mechanics. With this work, we suggest that the extracellular matrix-defined mechanical status of retinal pigmented epithelium is a novel parameter for visual function.

SignificanceIn the retina, the retinal pigmented epithelium (RPE) is responsible for the daily phagocytosis of photoreceptor cell fragments, a process vital for visual function. Along the visual axis, there is a natural decrease in the ratio of photoreceptors to RPE cells, indicating a decrease in RPE functional demand. This study reveals that the density of laminins in RPE basement membrane also diminishes along this axis, critically influencing RPE function by regulating its contractility. For the first time, we demonstrate the presence of a laminin- defined mechanical gradient within the RPE, which determines its capacity to support photoreceptor cells. Our findings highlight the importance of mechanical properties as a key factor in visual function, offering new insights into retinal health and disease.",NA,"biorxiv","2024-08-15"
"10.1101/2024.08.14.607919","Glucose uptake in pigment glia suppresses tau-induced inflammation and photoreceptor degeneration in Drosophila","Oka, M.; Nakajima, S.; Suzuki, E.; Yamamoto, S.; Ando, K.","Kanae Ando","Tokyo Metropolitan University","2024-08-19","1","new results","cc_no","neuroscience","https://www.biorxiv.org/content/early/2024/08/19/2024.08.14.607919.source.xml","Brain inflammation contributes to the pathogenesis of neurodegenerative diseases such as Alzheimer's disease (AD). Glucose hypometabolism and glial activation are pathological features seen in AD brains; however, the connection between the two is not fully understood. Using a Drosophila model of AD, we identified that glucose metabolism in glia plays a critical role in neuroinflammation under disease conditions. Expression of human tau in the retinal cells, including photoreceptor neurons and pigment glia, causes photoreceptor degeneration accompanied by inclusion formation and swelling of lamina glial cells. We found that inclusions are formed by glial phagocytosis, and swelling of the laminal cortex correlates with the expression of antimicrobial peptides (AMPs). Co-expression of human glucose transporter 3 (GLUT3) with tau in the retina does not affect tau levels but suppresses these inflammatory responses and photoreceptor degeneration. We also found that expression of GLUT3, specifically in the pigment glia, is sufficient to suppress inflammatory phenotypes and mitigate photoreceptor degeneration in the tau-expressing retina. Our results suggest that glial glucose metabolism contributes to inflammatory responses and neurodegeneration in tauopathy.",NA,"biorxiv","19955"
"10.1101/2024.08.16.608218","Dialogues in colour and behaviour - Integration of complex signalling traits and physiology","Patro, S.; Saravanan, T.; Parag, A.; Thaker, M.","Subhasmita Patro","Indian Institute of Science","2024-08-19","1","new results","cc_by_nc_nd","animal behavior and cognition","https://www.biorxiv.org/content/early/2024/08/19/2024.08.16.608218.source.xml","Animal communication can be complex, often involving multiple static and dynamic traits. The extent to which these traits are correlated can elucidate their function as either redundant or multiple messages. Using the agamid lizard, Psammophilus dorsalis, as a model system we examined patterns of trait expression and the role of steroid hormones in mediating these traits during social interactions. We staged male-male interactions in the lab and measured the repertoire of display behaviour and colours, which change dynamically in the visible and ultraviolet ranges in different body regions. Additionally, we measured testosterone and corticosterone levels before and after the social trials. Our results show that within behaviour and colour trait categories, components were strongly correlated within individuals, suggesting either a shared physiological pathway or redundant information content. However, across trait categories, correlation patterns varied. The chromatic contrast of the (yellow) dorsal region of lizards was correlated with both body size and level of aggression, whereas the size of UV patches was correlated with body size only. We also found a negative association between baseline corticosterone levels, body size and dorsal yellow chromatic contrast, suggesting a mechanistic link between these traits. However, social interaction induced testosterone and corticosterone levels were uncorrelated with the expression of the dynamic behavioural and colour displays during the social interactions itself. Notably, the intensity of colour and behavioural displays of males were matched by their opponents. Overall, our results suggest that multiple signalling traits can ensure both redundancy as well as provide multiple messages to receivers, thus improving the robustness of information transfer, particularly during competitions which have high fitness consequences.",NA,"biorxiv","19955"
"10.1101/2024.08.21.608989","Facial and body colouration are linked to social rank in the African cichlid, Astatotilapia burtoni","Peros, M.; Chang, A.; Martashvili, A.; Alvarado, S. G.","Sebastian G. Alvarado","Queens College, CUNY; The Graduate Center, CUNY","2024-08-22","1","new results","cc_by_nc_nd","animal behavior and cognition","https://www.biorxiv.org/content/early/2024/08/22/2024.08.21.608989.source.xml","Animal colouration is fundamentally important for social communication within conspecifics to advertising threat to competitors or fitness to possible mates. Social status and animal colouration are covarying traits that are plastic in response to dynamic environments. In the African cichlid, Astatotilapia burtoni, body colouration and behaviour have been extensively reported to vary with social rank. However, the nature of the interaction between these two traits is poorly understood. We hypothesise that pigmentation patterns could be linked to the behavioural repertoires underlying social status and can be resolved to regions on the cichlid body plan. To test this hypothesis, we generated Territorial (T) and Non-territorial (NT) males and employed computer vision tools to quantify and visualise patterns/colour enrichment associated with stereotyped T/NT male behaviour. We report colour-behaviour interactions localised in specific areas of the body and face for two colour morphs, illustrating a more nuanced view of social behaviour and pigmentation. Since behavioural and morphological variation are key drivers of selection in the East African Great Rift Lakes, we surmise our data may be translatable to other cichlid lineages and underline the importance of trait covariance in sexual selection and male competition.",NA,"biorxiv","19958"
"10.1101/2024.08.22.609266","Damsels in a hidden colour: development of ultraviolet sensitivity and colour patterns in damselfishes (Pomacentridae)","Tettamanti, V.; Marshall, J.; Cheney, K.; Cortesi, F.","Valerio Tettamanti","University of Queensland","2024-08-23","1","new results","cc_no","ecology","https://www.biorxiv.org/content/early/2024/08/23/2024.08.22.609266.source.xml","Damselfishes (Pomacentridae) are widespread and highly abundant on tropical coral reefs. They exhibit diverse body colouration within and between the ~250 species and across ontogenetic stages. In addition to human visible colours (i.e., 400-700 nm), most adult damselfishes reflect ultraviolet (UV, 300-400 nm) colour patches. UV sensitivity and UV colour signals are essential for feeding and form the basis for a secret communication channel invisible to the many UV-blind predatory fish on the reef; however, how these traits develop across ontogenetic stages, and their distribution across the damselfish family is poorly characterised. Here, we used UV photography, phylogenetic reconstructions of opsin genes, differential gene expression analysis (DGE) of retinal samples, to investigate the development of UV vision and colour patterns in three ontogenetic stages (pre-settlement larval, juvenile, and adult) of eleven damselfish species. Using DGE, we found similar gene expression between juveniles and adults, which strongly differed from larvae. All species and all stages expressed at least one UV-sensitive sws1 opsin gene. However, UV body colour patterns only started to appear at the juvenile stage. Moreover, Pomacentrus species displayed highly complex UV body patterns that were correlated with the expression of two sws1 copies. This could mean that some damselfishes can discriminate colours that change only in their UV component. We demonstrate dramatic shifts in both UV sensitivity and UV colouration across the development stages of damselfish, while highlighting the importance of considering ontogeny when studying the coevolution of visual systems and colour signals.",NA,"biorxiv","19959"
"10.1101/2024.08.29.610391","Functional characterisation of neuropeptides that act as ligands for both calcitonin-type and pigment-dispersing factor-type receptors in a deuterostome","Cong, X.; Liu, H.; Elphick, M. R.; Chen, M.","Muyan Chen","Ocean University of China","2024-08-30","1","new results","cc_no","neuroscience","https://www.biorxiv.org/content/early/2024/08/30/2024.08.29.610391.source.xml","The calcitonin (CT) family of related peptides exert their diverse physiological effects in mammals via two G-protein coupled receptors, CTR and the CTR-like receptor CLR. Analysis of the phylogenetic distribution of CT-type signaling has revealed the occurrence of CT-type peptides and CTR/CLR-type proteins in deuterostome and protostome invertebrates. Furthermore, experimental studies have revealed that in the protostome Drosophila melanogaster the CT-like peptide DH31 can act as a ligand for a CTR/CLR-type receptor and a pigment-dispersing factor (PDF) receptor. Here we investigated the signaling mechanisms and functions of CT-type neuropeptides in a deuterostome invertebrate, the sea cucumber Apostichopus japonicus (phylum Echinodermata). In A. japonicus, a single gene encodes two CT-type peptides (AjCT1 and AjCT2), both of which act as ligands for a CTR/CLR-type receptor (AjCTR) and two PDF-type receptors (AjPDFR1, AjPDFR2), but with differential activation of downstream cAMP/PKA, Gq/Ca2+/PKC and ERK1/2 signaling pathways. Analysis of the expression of the gene encoding AjCT1 and AjCT2 revealed transcripts in a variety of organ systems, but with highest expression in the circumoral nervous system. In vitro pharmacological experiments revealed that AjCT1 and/or AjCT2 cause dose-dependent relaxation of longitudinal body wall muscle and intestine preparations. Furthermore, in vivo pharmacological experiments and loss-of-function tests revealed a potential physiological role for AjCT2 signaling in promoting feeding and growth in A. japonicus. This is the first study to obtain evidence that CT-type peptides can act as ligands for both CTR/CLR-type and PDF-type receptors in a deuterostome. Furthermore, because of the economic importance of A. japonicus as a foodstuff, discovery of the potential role for CT-type peptides as regulators of feeding and growth in this species may provide a basis for practical applications in aquaculture.",NA,"biorxiv","19966"
"10.1101/2024.09.09.612161","Three-color single-molecule localization microscopy in chromatin","Acosta, N.; Gong, R.; Su, Y.; Frederick, J.; Medina, K.; Li, W. S.; Mohammadian, K.; Almassalha, L.; Backman, V.","Vadim Backman","Northwestern University","2024-09-13","1","new results","cc_no","bioengineering","https://www.biorxiv.org/content/early/2024/09/13/2024.09.09.612161.source.xml","Super-resolution microscopy has revolutionized our ability to visualize structures below the diffraction limit of conventional optical microscopy and is particularly useful for investigating complex biological targets like chromatin. Chromatin exhibits a hierarchical organization with structural compartments and domains at different length scales, from nanometers to micrometers. Single molecule localization microscopy (SMLM) methods, such as STORM, are essential for studying chromatin at the supra-nucleosome level due to their ability to target epigenetic marks that determine chromatin organization. Multi-label imaging of chromatin is necessary to unpack its structural complexity. However, these efforts are challenged by the high-density nuclear environment, which can affect antibody binding affinities, diffusivity and non-specific interactions. Optimizing buffer conditions, fluorophore stability, and antibody specificity is crucial for achieving effective antibody conjugates. Here, we demonstrate a sequential immunolabeling protocol that reliably enables three-label studies within the dense nuclear environment. This protocol couples multiplexed localization datasets with a robust analysis algorithm, which utilizes localizations from one target as seed points for distance, density and multi-label joint affinity measurements to explore complex organization of all three targets. Applying this multi-plexed algorithm to analyze distance and joint density reveals that heterochromatin and euchromatin are not-distinct territories, but that localization of transcription and euchromatin couple with the periphery of heterochromatic clusters. This work is a crucial step in molecular imaging of the dense nuclear environment as multi-label capacity enables for investigation of complex multi-component systems like chromatin with enhanced accuracy.",NA,"biorxiv","19980"
"10.1101/2024.09.16.612994","Interaction between facial expression and color in modulating EPR P3","Hasegawa, Y.; Tamura, H.; Nakauchi, S.; Minami, T.","Tetsuto Minami","Toyohashi University of Technology","2024-09-17","1","new results","cc_by_nc_nd","neuroscience","https://www.biorxiv.org/content/early/2024/09/17/2024.09.16.612994.source.xml","The relationships between facial expression and color affect human cognition functions such as perception and memory. However, whether these relationships influence attention remains unclear. Additionally, whether facial expressions affect selective attention is unknown; for example, reddish angry faces increase negative social evaluation or emotion intensity, but it is unclear whether selective attention is similarly enhanced. To investigate these questions, we examined whether event-related potentials for faces vary depending on facial expression and color by recording electroencephalography (EEG) data. We conducted an oddball task using stimuli that combined facial expressions (angry, neutral) and facial colors (original, red, green). The participants counted the number of times a rarely appearing target face stimulus appeared among the standard face stimuli. The results indicated that the difference in P3 amplitudes for the target and standard faces depended on the combinations of facial expressions and facial colors; the P3 amplitudes for red angry faces were greater than those for red neutral faces. Additionally, there was no significant main effect or interaction effect of facial expression or facial color on P1 amplitudes for the target, and there were significant main effects of facial expression only on the N170 amplitude. These findings suggest that the intensity of a human's selective attention to facial expressions varies according to the higher-order semantic processing of the relationship between emotion and color rather than simple facial expression or facial color effects individually. Our results support the idea that red color increases the human response to anger from an EEG perspective.",NA,"biorxiv","19984"
"10.1101/2024.09.19.613886","Circadian modulation of mosquito host-seeking persistence by Pigment-Dispersing Factor impacts daily biting patterns","Dong, L.; Hormigo, R.; Barnett, J. M.; Greppi, C.; Duvall, L. B.","Laura B Duvall","Columbia University","2024-09-19","1","new results","cc_by_nc","neuroscience","https://www.biorxiv.org/content/early/2024/09/19/2024.09.19.613886.source.xml","Daily rhythms in mosquito attraction to humans are thought to drive biting patterns and contribute to disease transmission dynamics. Behavioral rhythms in many insects are controlled by specialized clock cells in the brain that are coordinated by the neuropeptide Pigment-Dispersing Factor (PDF). We show that female Aedes aegypti mosquitoes with genetically disrupted PDF display altered daily behavioral timing with reduced locomotor activity and biting in the morning. Using an automated behavioral tracking system, we also report that mosquitoes exhibit daily modulation of response persistence to the host cue carbon dioxide and loss of PDF alters this pattern. These findings indicate that PDF regulates temporal features of host-seeking behavior that promote biting success at specific times of day and may underlie blood feeding patterns observed in the field.",NA,"biorxiv","19986"
"10.1101/2024.09.16.613182","Density-Dependent Colour Scanning Electron Microscopy (DDC-SEM). Applications in the study of calcified tissues and visual impact.","Tsolaki, E.; Hunter, L.; Chester, A. H.; Bertazzo, S.","Sergio Bertazzo","University College London","2024-09-19","1","confirmatory results","cc_no","scientific communication and education","https://www.biorxiv.org/content/early/2024/09/19/2024.09.16.613182.source.xml","Scanning Electron Microscopy (SEM) is widely used as a technique for materials characterization. It has also been successfully applied to the imaging of biological samples, providing invaluable insights into the topography, morphology and composition of biological structures. A particular method combining different SEM detectors, named Density-Dependent Coloured SEM (DDC-SEM), has proven to be most useful for the identification and visualization of minerals in soft tissues. The method consists of a manipulation of original greyscale SEM images to produce coloured images that provide both topography and density information for samples with components of different densities. Here we provide a discussion on how to use DDC-SEM to aid the visualization and intuitive understanding of pathological calcification. This method has become popular not only for its scientific improvement of conventional SEM greyscale images, but also for its aesthetical merits.",NA,"biorxiv","19986"
"10.1101/2024.09.16.613362","More than fruity scents: floral biology, scent and spectral reflectance of twelve Annonaceae species","Liu, M.-F.; Chen, J.; Pang, C.-C.; Scharaschkin, T.; Saunders, R. M. K.","Ming-Fai Liu","Kadoorie Farm & Botanic Garden","2024-09-20","1","new results","cc_no","ecology","https://www.biorxiv.org/content/early/2024/09/20/2024.09.16.613362.source.xml","The pantropical family Annonaceae possesses a broad array of floral phenotypes and pollination specialisations. Being the most species-rich lineage in the magnoliids, Annonaceae are a major flowering plant component of tropical rainforests, and are important in the plant-pollinator network of this biome. Insects such as beetles, flies, bees, cockroaches and thrips have been reported as their pollinators. Although there has been considerable effort to assess their interactions with pollinators, attempts to characterise the visual and olfactory communication channels between them are scarce. Here, we report the floral phenology and characterise the spectral reflectance and odour of 12 Annonaceae species from five genera, viz. Meiogyne, Monoon, Polyalthia, Pseuduvaria, and Uvaria. Pseuduvaria species are either monoecious or dioecious while the four genera produce hermaphroditic flowers. The Meiogyne species are likely pollinated by small beetles; the Polyalthia and Pseuduvaria species are likely pollinated by both beetles and flies; and the Uvaria species is likely pollinated by both beetles and bees. All species produce flowers that are not reflective in the 300-350 nm UV spectrum, and have various spectral reflectance profile across the remaining UV and visible spectra. We detected diverse floral volatiles across all the species assessed. The flowers of the small beetle-pollinated species, including Meiogyne species and Polyalthia xanthocarpa, emitted mostly branched-chain esters, including isobutyl acetate and isoamyl acetate. The Pseuduvaria species emitted scent reminiscent of rotten fruit, largely consisting of 2,3-butanediol, a common by-product in yeast fermentation. The flowers of Uvaria concava, which were visited by both bees and beetles, released mainly straight-chain esters, including methyl hexanoate and methyl (Z)-4-octenoate. A corrugated inner petal outgrowth was observed in Meiogyne and Pseuduvaria; this functions as a food body reward in Meiogyne, but as a nectary gland for Pseuduvaria. This study provides insights into how Annonaceae flowers attract different guilds of pollinators.",NA,"biorxiv","19987"
"10.1101/2024.09.21.614269","Pollinator visitation pattern and differential reproductive compatibilities maintain bract colour polymorphism in a nocturnal ginger from Western Ghats, India","Shrotri, S.; Gowda, V.","Saket Shrotri","Indian Institute of Science Education and Research Bhopal","2024-09-24","1","new results","cc_by_nc_nd","ecology","https://www.biorxiv.org/content/early/2024/09/24/2024.09.21.614269.source.xml","Polymorphism, the presence of discrete floral morphs within a population, can be maintained by positive or negative frequency selection. Pollinators often show a positive frequency-dependent foraging which confers reproductive advantage to common morphs over rare morphs. However, pollinator-mediated selections often act on visual floral displays. Here, we investigate hawkmoth-mediated selection in a nocturnal Curcuma caulina (Zingiberaceae) with bract colour polymorphism, where the role of visual display is minimal. We used path analyses to explain maintenance of differential morph abundances in C. caulina. For this, we quantified inter-morph trait variations in floral structures, nectar traits, pollinator visitations, physiological compatibilities and reproductive fitness. We noted that the rarest morph was self-compatible, exhibited higher nectar reward and pollinator visits, and low reproductive fitness, whereas the two common morphs were complete to partially self-incompatible, with lower nectar rewards and pollinator visits, but higher reproductive fitness. We conclude that while hawkmoths show a positive response to floral rewards, self-compatibility confers lower reproductive fitness to the nectar-rich rare morphs. In contrast, self-incompatibility confers higher fitness to the common morphs despite lower pollinator visits. Thus, colour polymorphism in nocturnal C. caulina is explained by floral traits associated with bract colour, which are under pollinator-mediated selection.","NA","biorxiv","19991"
